,comment_id,season,match_id,match_name,home_team,away_team,current_innings,innings_id,over,ball,runs,shortText,isBoundary,isWide,isNoball,batsman1_id,batsman1_name,batsman1_runs,batsman1_balls,bowler1_id,bowler1_name,bowler1_overs,bowler1_maidens,bowler1_runs,bowler1_wkts,batsman2_id,batsman2_name,batsman2_runs,batsman2_balls,bowler2_id,bowler2_name,bowler2_overs,bowler2_maidens,bowler2_runs,bowler2_wkts,wicket_id,wkt_batsman_name,wkt_bowler_name,wkt_batsman_runs,wkt_batsman_balls,wkt_text,isRetiredHurt,text,preText,postText
212,214030,2023.0,1359475,GT v CSK,GT,CSK,GT,2,15,3,2,"Deshpande to Shankar, 2 runs",False,False,False,477021,Vijay Shankar,12.0,11.0,822553.0,Tushar Deshpande,2.3,0.0,33.0,0.0,1070173.0,Shubman Gill,57.0,34.0,1175429.0,Rajvardhan Hangargekar,3.0,0.0,29.0,2.0,,,,,,,False,"muscles it away. Looking for a pull but it hurries onto him, and he ends up hitting it down the ground. Manages to clear mid-off, though",,
213,214040,2023.0,1359475,GT v CSK,GT,CSK,GT,2,15,4,1,"Deshpande to Shankar, 1 run",False,False,False,477021,Vijay Shankar,13.0,12.0,822553.0,Tushar Deshpande,2.4,0.0,34.0,0.0,1070173.0,Shubman Gill,57.0,34.0,1175429.0,Rajvardhan Hangargekar,3.0,0.0,29.0,2.0,,,,,,,False,opens the face for a single to deep third,,
214,214050,2023.0,1359475,GT v CSK,GT,CSK,GT,2,15,5,6,"Deshpande to Shubman Gill, SIX",True,False,False,1070173,Shubman Gill,63.0,35.0,822553.0,Tushar Deshpande,2.5,0.0,40.0,0.0,477021.0,Vijay Shankar,13.0,12.0,1175429.0,Rajvardhan Hangargekar,3.0,0.0,29.0,2.0,,,,,,,False,oh the bat has made sweet noise all night but if Gaikwad had been on the boundary and not in off the rope. It ids a flat flick over midwicket. Gaikwad backtracks but can't get it,,
215,214060,2023.0,1359475,GT v CSK,GT,CSK,GT,2,15,6,0,"Deshpande to Shubman Gill, OUT",False,False,False,1070173,Shubman Gill,63.0,36.0,822553.0,Tushar Deshpande,3.0,0.0,40.0,1.0,477021.0,Vijay Shankar,13.0,12.0,1175429.0,Rajvardhan Hangargekar,3.0,0.0,29.0,2.0,1070173.0,Shubman Gill,Tushar Deshpande,63.0,36.0,Shubman Gill c Gaikwad b Deshpande 63 (36b 6x4 3x6) SR: 175.00,False,this one is an easy catch for eep midwicket. Tries the pull but it goes off the toe end of the bat as he is dragging it from wide outside off. Taken at deep midwicket this time,,
216,215010,2023.0,1359475,GT v CSK,GT,CSK,GT,2,16,1,1,"Santner to Shankar, 1 run",False,False,False,477021,Vijay Shankar,14.0,13.0,502714.0,Mitchell Santner,3.1,0.0,26.0,0.0,423838.0,Rahul Tewatia,0.0,0.0,822553.0,Tushar Deshpande,3.0,0.0,40.0,1.0,,,,,,,False,"on a length, into the pads, worked away for one",<p>Rahul Tewatia is the new man in. Shankar on strike. CSK still have a chance. Santner comes back</p>,
217,215020,2023.0,1359475,GT v CSK,GT,CSK,GT,2,16,2,1,"Santner to Tewatia, 1 run",False,False,False,423838,Rahul Tewatia,1.0,1.0,502714.0,Mitchell Santner,3.2,0.0,27.0,0.0,477021.0,Vijay Shankar,14.0,13.0,822553.0,Tushar Deshpande,3.0,0.0,40.0,1.0,,,,,,,False,"soft hands, open the face, gets a single to the right of point",<p>Tewatia to face for the first time this IPL</p>,
218,215030,2023.0,1359475,GT v CSK,GT,CSK,GT,2,16,3,4,"Santner to Shankar, FOUR",True,False,False,477021,Vijay Shankar,18.0,14.0,502714.0,Mitchell Santner,3.3,0.0,31.0,0.0,423838.0,Rahul Tewatia,1.0,1.0,822553.0,Tushar Deshpande,3.0,0.0,40.0,1.0,,,,,,,False,GT are not letting CSK back in it. Shankar goes back to hit a slow length ball between long-off and deep extra cover. Stokes and Conway converge but neither man dives in the end,,
219,215040,2023.0,1359475,GT v CSK,GT,CSK,GT,2,16,4,1,"Santner to Shankar, 1 run",False,False,False,477021,Vijay Shankar,19.0,15.0,502714.0,Mitchell Santner,3.4,0.0,32.0,0.0,423838.0,Rahul Tewatia,1.0,1.0,822553.0,Tushar Deshpande,3.0,0.0,40.0,1.0,,,,,,,False,driven to deep extra cover,,
220,215050,2023.0,1359475,GT v CSK,GT,CSK,GT,2,16,5,0,"Santner to Tewatia, no run",False,False,False,423838,Rahul Tewatia,1.0,2.0,502714.0,Mitchell Santner,3.5,0.0,32.0,0.0,477021.0,Vijay Shankar,19.0,15.0,822553.0,Tushar Deshpande,3.0,0.0,40.0,1.0,,,,,,,False,"slower in the air, wide, short of a length, can't find a gap",,
221,215060,2023.0,1359475,GT v CSK,GT,CSK,GT,2,16,6,0,"Santner to Tewatia, no run",False,False,False,423838,Rahul Tewatia,1.0,3.0,502714.0,Mitchell Santner,4.0,0.0,32.0,0.0,477021.0,Vijay Shankar,19.0,15.0,822553.0,Tushar Deshpande,3.0,0.0,40.0,1.0,,,,,,,False,"again slow in the air, looks to work this to leg, but ends up playing it too close to Santner",,"<p>Into the death overs we go, but first a strategic timeout</p>"
222,216010,2023.0,1359475,GT v CSK,GT,CSK,GT,2,17,1,1,"Chahar to Shankar, 1 run",False,False,False,477021,Vijay Shankar,20.0,16.0,447261.0,Deepak Chahar,2.1,0.0,15.0,0.0,423838.0,Rahul Tewatia,1.0,3.0,502714.0,Mitchell Santner,4.0,0.0,32.0,0.0,,,,,,,False,gets a single to short fine leg,<p>Thirty-four off 24. You'd back the chasing side on most occasions</p>,
223,216020,2023.0,1359475,GT v CSK,GT,CSK,GT,2,17,2,1,"Chahar to Tewatia, 1 run",False,False,False,423838,Rahul Tewatia,2.0,4.0,447261.0,Deepak Chahar,2.2,0.0,16.0,0.0,477021.0,Vijay Shankar,20.0,16.0,502714.0,Mitchell Santner,4.0,0.0,32.0,0.0,,,,,,,False,"on a length, full, pushed to long-on for one",<p>Chahar is back by the way. Around the wicket</p>,
224,216030,2023.0,1359475,GT v CSK,GT,CSK,GT,2,17,3,0,"Chahar to Shankar, no run",False,False,False,477021,Vijay Shankar,20.0,17.0,447261.0,Deepak Chahar,2.3,0.0,16.0,0.0,423838.0,Rahul Tewatia,2.0,4.0,502714.0,Mitchell Santner,4.0,0.0,32.0,0.0,,,,,,,False,"no room, full and straight, pushed to mid-off",,
225,216040,2023.0,1359475,GT v CSK,GT,CSK,GT,2,17,4,1,"Chahar to Shankar, 1 run",False,False,False,477021,Vijay Shankar,21.0,18.0,447261.0,Deepak Chahar,2.4,0.0,17.0,0.0,423838.0,Rahul Tewatia,2.0,4.0,502714.0,Mitchell Santner,4.0,0.0,32.0,0.0,,,,,,,False,"backs away early, Chahar stays on a length, Shankar toe-ends it over the infield for a single to deep cover",,
226,216050,2023.0,1359475,GT v CSK,GT,CSK,GT,2,17,5,0,"Chahar to Tewatia, no run",False,False,False,423838,Rahul Tewatia,2.0,5.0,447261.0,Deepak Chahar,2.5,0.0,17.0,0.0,477021.0,Vijay Shankar,21.0,18.0,502714.0,Mitchell Santner,4.0,0.0,32.0,0.0,,,,,,,False,"gets a short and wide ball, but cuts it straight to extra cover",,
227,216060,2023.0,1359475,GT v CSK,GT,CSK,GT,2,17,6,1,"Chahar to Tewatia, 1 run",False,False,False,423838,Rahul Tewatia,3.0,6.0,447261.0,Deepak Chahar,3.0,0.0,18.0,0.0,477021.0,Vijay Shankar,21.0,18.0,502714.0,Mitchell Santner,4.0,0.0,32.0,0.0,,,,,,,False,"again short and wide, but seems like a slower delivery, and is cut to deep cover for one","<p>Anish Rijal: ""Very long tail of GT, these two needs to take into 19th over with not more than 20 to get. ""</p>",
228,217010,2023.0,1359475,GT v CSK,GT,CSK,GT,2,18,1,0,"Hangargekar to Tewatia, no run",False,False,False,423838,Rahul Tewatia,3.0,7.0,1175429.0,Rajvardhan Hangargekar,3.1,0.0,29.0,2.0,477021.0,Vijay Shankar,21.0,18.0,447261.0,Deepak Chahar,3.0,0.0,18.0,0.0,,,,,,,False,"on a length, angling across him, he is looking to go over extra but is beaten",<p>Hangargekar to bowl out. Chahar and Deshpande might bowl 19 and 20</p>,
229,217020,2023.0,1359475,GT v CSK,GT,CSK,GT,2,18,2,0,"Hangargekar to Tewatia, no run",False,False,False,423838,Rahul Tewatia,3.0,8.0,1175429.0,Rajvardhan Hangargekar,3.2,0.0,29.0,2.0,477021.0,Vijay Shankar,21.0,18.0,447261.0,Deepak Chahar,3.0,0.0,18.0,0.0,,,,,,,False,"two dots. Nearly two a ball now. Wide length ball, driven hard but straight to mid-off",,
230,217030,2023.0,1359475,GT v CSK,GT,CSK,GT,2,18,3,1,"Hangargekar to Tewatia, 1 run",False,False,False,423838,Rahul Tewatia,4.0,9.0,1175429.0,Rajvardhan Hangargekar,3.3,0.0,30.0,2.0,477021.0,Vijay Shankar,21.0,18.0,447261.0,Deepak Chahar,3.0,0.0,18.0,0.0,,,,,,,False,"full, nearly a yorker, driven to long-off for a single",,
231,217040,2023.0,1359475,GT v CSK,GT,CSK,GT,2,18,4,6,"Hangargekar to Shankar, SIX",True,False,False,477021,Vijay Shankar,27.0,19.0,1175429.0,Rajvardhan Hangargekar,3.4,0.0,36.0,2.0,423838.0,Rahul Tewatia,4.0,9.0,447261.0,Deepak Chahar,3.0,0.0,18.0,0.0,,,,,,,False,"that will relieve some nerves in the dugout. Shankar is probably expecting a short ball, moves back and across early early, and pulls this from outside off to clear midwicket",,
232,217050,2023.0,1359475,GT v CSK,GT,CSK,GT,2,18,5,0,"Hangargekar to Shankar, no run",False,False,False,477021,Vijay Shankar,27.0,20.0,1175429.0,Rajvardhan Hangargekar,3.5,0.0,36.0,2.0,423838.0,Rahul Tewatia,4.0,9.0,447261.0,Deepak Chahar,3.0,0.0,18.0,0.0,,,,,,,False,"wide on the crease, wide full toss, not called, and they have reviewed it. This is usually a subjective call so I don't know how you can get it overturned. One thing I can objectively tell you is that Shankar has not shuffled across so the tram line should be a pretty fair indicator. And he is touch and go on that tram line. Probably has gone over the tram line. So the original decision has to stay",,
233,217060,2023.0,1359475,GT v CSK,GT,CSK,GT,2,18,6,0,"Hangargekar to Shankar, OUT",False,False,False,477021,Vijay Shankar,27.0,21.0,1175429.0,Rajvardhan Hangargekar,4.0,0.0,36.0,3.0,423838.0,Rahul Tewatia,4.0,9.0,447261.0,Deepak Chahar,3.0,0.0,18.0,0.0,477021.0,Vijay Shankar,Rajvardhan Hangargekar,27.0,21.0,V Shankar c Santner b Hangargekar 27 (21b 2x4 1x6) SR: 128.57,False,"big wicket. Looks like a slower ball. Shankar is looking to go in the air and down the ground. Gets the right length, right in the slot, but he seems to have bowled a slower ball. Shankar ends up toe-ending it for a catch half way between mid-off and long-off. CSK still alive",,"<p>Who bowls this over? Chahar, I eould say</p>"
234,218010,2023.0,1359475,GT v CSK,GT,CSK,GT,2,19,1,0,"Chahar to Tewatia, no run",False,False,False,423838,Rahul Tewatia,4.0,10.0,447261.0,Deepak Chahar,3.1,0.0,18.0,0.0,793463.0,Rashid Khan,0.0,0.0,1175429.0,Rajvardhan Hangargekar,4.0,0.0,36.0,3.0,,,,,,,False,Chahar it is. Around the wicket,,"<p>slower ball into the pitch, beats his attempt to cut</p>"
235,218020,2023.0,1359475,GT v CSK,GT,CSK,GT,2,19,2,4,"Chahar to Tewatia, 4 leg byes",False,False,False,423838,Rahul Tewatia,4.0,11.0,447261.0,Deepak Chahar,3.2,0.0,18.0,0.0,793463.0,Rashid Khan,0.0,0.0,1175429.0,Rajvardhan Hangargekar,4.0,0.0,36.0,3.0,,,,,,,False,"speared into the toes, Tewatia misses, but the ball kisses the pad, and squirts between the diving keeper and short fine. Dhoni might be cramping as he gets up after diving",,
236,218030,2023.0,1359475,GT v CSK,GT,CSK,GT,2,19,3,1,"Chahar to Tewatia, 1 run",False,False,False,423838,Rahul Tewatia,5.0,12.0,447261.0,Deepak Chahar,3.3,0.0,19.0,0.0,793463.0,Rashid Khan,0.0,0.0,1175429.0,Rajvardhan Hangargekar,4.0,0.0,36.0,3.0,,,,,,,False,"shortish, into the pitch, pulled to deep midwicket for one",,
237,218040,2023.0,1359475,GT v CSK,GT,CSK,GT,2,19,4,6,"Chahar to Rashid Khan, SIX",True,False,False,793463,Rashid Khan,6.0,1.0,447261.0,Deepak Chahar,3.4,0.0,25.0,0.0,423838.0,Rahul Tewatia,5.0,12.0,1175429.0,Rajvardhan Hangargekar,4.0,0.0,36.0,3.0,,,,,,,False,"what a njght for Rashid so far. Wickets early with the ball, and smacks the first ball he faces for a six. Slower ball, right in the slot, Rashid clears the front leg, and goes over midwicket",<p>Two a ball now. Rashid Khan is your new batter</p>,
238,218050,2023.0,1359475,GT v CSK,GT,CSK,GT,2,19,5,4,"Chahar to Rashid Khan, FOUR",True,False,False,793463,Rashid Khan,10.0,2.0,447261.0,Deepak Chahar,3.5,0.0,29.0,0.0,423838.0,Rahul Tewatia,5.0,12.0,1175429.0,Rajvardhan Hangargekar,4.0,0.0,36.0,3.0,,,,,,,False,"this might be the game. Chahar bowls on-pace this time, but shortish and widish with short third inside the circle. Rashid throws his bat at it, and gets enough bat on it to clear short third",,
239,218060,2023.0,1359475,GT v CSK,GT,CSK,GT,2,19,6,0,"Chahar to Rashid Khan, no run",False,False,False,793463,Rashid Khan,10.0,3.0,447261.0,Deepak Chahar,4.0,0.0,29.0,0.0,423838.0,Rahul Tewatia,5.0,12.0,1175429.0,Rajvardhan Hangargekar,4.0,0.0,36.0,3.0,,,,,,,False,"Rashid wants to end this one right here, right now. He jumps out of the crease, but is beaten by the slower bouncer",,
240,219020,2023.0,1359475,GT v CSK,GT,CSK,GT,2,20,1,6,"Deshpande to Tewatia, SIX",True,False,False,423838,Rahul Tewatia,11.0,13.0,822553.0,Tushar Deshpande,3.1,0.0,47.0,1.0,793463.0,Rashid Khan,10.0,3.0,447261.0,Deepak Chahar,4.0,0.0,29.0,0.0,,,,,,,False,"scores level. Tewatia has guessed correctly that Deshpande is going full and wide. He moves across, gets right behind it, finds the length right in the slot, and clears mid-off with ease",,
241,219010,2023.0,1359475,GT v CSK,GT,CSK,GT,2,20,1,1,"Deshpande to Tewatia, 1 wide",False,True,False,423838,Rahul Tewatia,5.0,12.0,822553.0,Tushar Deshpande,3.0,0.0,41.0,1.0,793463.0,Rashid Khan,10.0,3.0,447261.0,Deepak Chahar,4.0,0.0,29.0,0.0,,,,,,,False,"full and wide, too wide. Called too. Thankfully, CSK don't review it","<p>Eight required off the last over. Deshpande to bowl it. Super Over, anyone? Mid-off, short third and fine leg up in the circle. Deshpande goes around the wicket</p>",
242,219030,2023.0,1359475,GT v CSK,GT,CSK,GT,2,20,2,4,"Deshpande to Tewatia, FOUR",True,False,False,423838,Rahul Tewatia,15.0,14.0,822553.0,Tushar Deshpande,3.2,0.0,51.0,1.0,793463.0,Rashid Khan,10.0,3.0,447261.0,Deepak Chahar,4.0,0.0,29.0,0.0,,,,,,,False,"Tewatia holds his arms aloft after drilling one for four past the bowler. Right in the slot again, and he hits it hard and right back at the umpire, who gets out of the way",,"<p><b>12.05am</b> The opening match started on a Friday, but it is Saturday by the time the presentations are done. not quite clinical, but still a comfortable enough win for the defending champions Gujarat Titans. That's all we have for you tonight, but we will be back before you even get a chance to miss us as tomorrow is a double header. See you then.</p><p><b>Midnight</b> The Player of the Match is <b>Rashid Khan</b>. He says: ""So happy to get the Man of the Match. Gives me so much of energy for the rest of the competition. Bowling to the leftie was hard but the more I keep it tight, it is better. I had it in my mind to keep it simple. Just bowl the right areas consistently. Batting is all about time spent in the nets. The kind of opportunity and confidence in me by the coaching staff and the captain does give me a lot of batting time in the nets. It helps me in the middle.""</p><p><b>11.55pm</b> We will soon be into day of this match with the presentation not yet done. <b>Hardik Pandya</b> says: ""I am obviously very happy, but we did put ourselves in a difficult position. We were very happy with 178 because at one point they looked like going past 200. But we kept getting wickets. Having the impact rule makes my job very difficult. There are too many options. Because of it, someone will always bowl less or late. My shot and Shubman's shot put the team in a difficult position. We have some standards inside the dressing room. We have to finish the games, and not Rash and Rahul all the time.""  </p><p><b>11.45pm</b> ""We were slightly short,"" says <b>MS Dhoni</b>, the losing captain. ""Another 15-20 runs would have been good. We all know there would be a little bit of dew. Also it was a 7.30pm start so the ball holds on a little early on. Also we could have batted properly in the middle overs as opposed to trying to muscle the ball. Rutu is a pleasure to watch. He has groomed himself very well, and makes the eight decisions under pressure. We can't afford to bowl no-balls. That is something in our control."" </p><p><b>11.38pm</b> That's a pretty comfortable win for the defending champions, GT. Led by Rashid Khan with the ball, they restricted CSL to 20 short of a par score, and then chased it down fairly easily. In the end, two blows from Rashid Khan turned a possibly tight finish to a walk in the park in the last over. The win will be extra sweet because they couldn't use their Impact Player properly thanks to the injury to Kane Williamson when fielding. The pace of the match hasn't been great with more than four hours taken</p>"
243,110,2023.0,1359476,PBKS v KKR,PBKS,KKR,PBKS,1,1,1,0,"Yadav to Prabhsimran Singh, no run",False,False,False,1161024,Prabhsimran Singh,0.0,1.0,376116.0,Umesh Yadav,0.1,0.0,0.0,0.0,28235.0,Shikhar Dhawan,0.0,0.0,,,,,,,,,,,,,False,full ball outside off. Bit of swing away and he mistimes a drive to mid off. A gentle roar for that first ball at Mohali since 2019 at the IPL,"<p><B>3.29pm</b> Dhawan to open with Prabhsimran Singh. Umesh Yadav has the new ball. Interestingly Dhawan has never scored a fifty as captain.</p><p><b>Play <a href=""https://bailsout.espncricinfo.com/"">ESPNcricinfo's first AR-based game</a> - just aim and hit the stumps.</b></p><p>AS: ""Whats the point of having overseas players on the impact player list? "" -- Just had a re-read of the playing conditions and you are allowed to have overseas players on the bench because the substitute fielders can also come only from the five-man bench. The impact player will also come from that bench, which will definitely be an Indian player.</p><p><B>3.15pm</b> Hello all, welcome to the first double-header of the IPL. Mohali has stayed dry so far, something that was in doubt yesterday. Interesting that V Iyer does not make KKR's XI at the start, not only will that be a blow to his confidence but also the side does not trust him to bowl either. We may see him or Jagadeesan as the impact sub later when KKR bat.<BR><BR>Prabhsimran was the likely opener after a terrific SMAT for the Kings. There's a bunch of different ways they could play the impact sub later in the day, maybe even bringing in a Rishi Dhawan midway through their batting innings for his power hitting. </p><p>All right. What do you make of the teams? Let Sreshth know, and also ask him whom he is supporting.</p><p>Sifat Khawry: ""It's so delightful, and a proud moment for Afghanistan to have its genuine batter Gurbaz making debut in the IPL""</p><p><strong>PBKS</strong>: 1 Shikhar Dhawan (capt), 2 Prabhsimran Singh, 3 Bhanuka Rajapaksa, 4 Sikandar Raza, 5 Jitesh Sharma (wk), 6 Shahrukh Khan, 7 Sam Curran, 8 Nathan Ellis, 9 Harpreet Brar, 10 Rahul Chahar, 11 Arshdeep Singh. The <strong>subs are</strong> Rishi Dhawan, Taide, Short, Bhatia and Rathee.</p><p><strong>KKR</strong>: 1 Rahmanullah Gurbaz, 2 Mandeep Singh, 3 Nitish Rana, 4 Rinku Singh, 5 Andre Russell, 6 Shardul Thakur, 7 Sunil Narine, 8 Tim Southee, 9 Anukul Roy, 10 Umesh Yadav, 11 Varun Chakravarthy.  The <strong>subs are</strong> Suyash, Arora, Jagadeesan, V Iyer and Wiese</p><p><strong>3.01pm</strong> Time for the coin to be flipped... <b>KKR win the toss and bowl</b>. Rana says rain has been around, and expects moisture. ""Very few get this opportunity, so I'm excited to be captain,"" he says. <strong>Southee, Russell, Narine and Gurbaz</strong> are his foreign players. Dhawan wanted to bowl first as well. He wants to maintain his consistency in the tournament, and announces <strong>Rajapaksa, Curran, Ellis... and *forgets the fourth name*</strong>.</p><p>""How is the weather in Mohali? Will we have the first rain-affected match this IPL?"" --- Looks bright and clear for now, Vinod Rajpal</p><p>Micky_Cremona: ""Hello from UK! Not a good pre-season for Punjab. Jonny injured, Liam coming back from injury, Dhawan hardly had competitive cricket... but we've got Sikandar Raza in the form of his life! Hopefully he will deliver!""</p><p><strong>The pitch</strong> looks ""light brown in colour"" to Daren Ganga, and there isn't much grass. It feels hard too, and there shouldn't be too much of changes while batting first or chasing. There are relatively uneven boundary dimensions at the ground. </p><p><strong>2.50pm</strong> Dhawan, Raza, Curran and Arshdeep on one side; Russell, Narine, Thakur and Ferguson on the other. Who do you think are the favourites today? <a href=""https://www.espncricinfo.com/cricket-videos/ipl-2023-moody-punjab-kings-the-favourites-against-kolkata-knight-riders-1365942"">Tom Moody has</a> already made up his mind. And ICYMI, Australian <a href=""https://www.espncricinfo.com/story/jonny-bairstow-ruled-out-of-ipl-2023-australia-s-matthew-short-named-replacement-1365240"">Matt Short has replaced</a> Bairstow for PBKS, and might even open with Dhawan.</p><p>Neal: ""Keen to see how Sammy Curran will be used as a batsman, and expecting big things from Shikhar Dhawan to get his name in front of selectors in an ODI World Cup year"" --- I'm afraid Dhawan might never play for India again due to a combination of his own dip in form, Gill's remarkable success, and the plethora of opening options that India have</p><p><b>You can follow ball-by-ball commentary of the game <a href=""https://www.espncricinfo.com/hindi/series/indian-premier-league-2023-1345038/punjab-kings-vs-kolkata-knight-riders-2nd-match-1359476/live-cricket-score"">in Hindi</a>, and <a href=""https://www.espncricinfo.com/tamil/series/indian-premier-league-2023-1345038/punjab-kings-vs-kolkata-knight-riders-2nd-match-1359476/live-cricket-score"">in Tamil</a>.</b></p><p><strong>2.40pm</strong> Both of today's teams have been impacted by injuries or unavailability: no Iyer, Shakib, Litton, Rabada, Livingstone and Bairstow to begin with. So how do KKR cover for Iyer? <a href=""https://www.espncricinfo.com/cricket-videos/ipl-2023-how-can-kolkata-knight-riders-cover-for-shreyas-iyer-1365706"">Sanjay Manjrekar and Tom Moody discuss</a>. But never mind, Iyer's replacement <a href=""https://www.espncricinfo.com/story/leadership-role-not-new-for-rana-in-kolkata-knight-riders-set-up-1365549"">Nitish Rana says</a> captaincy is ""not new"" to him.</p><p>One side has a new captain by accident, another by choice. But they both opted for fresh coaches too, which <a href=""https://www.espncricinfo.com/series/indian-premier-league-2023-1345038/punjab-kings-vs-kolkata-knight-riders-2nd-match-1359476/match-preview"">Sreshth's preview</a> highlights. Both PBKS and KKR will be keen to improve on their performance from last year, when they had ended sixth and seventh, respectively.</p><p>Bhargav: ""It's the battle between two blow-hot-blow-cold teams.""</p><p><strong>2.30pm</strong> Time to travel north-east from Ahmedabad to Mohali; time to settle the dust of the IPL's mega opening less than 24 hours earlier. Because now the juggernaut moves on to Punjab Kings vs Kolkata Knight Riders in Mohali on what is a double-header Saturday. This is Himanshu saying hello from the live coverage this afternoon, as Sreshth gets set to wear the purple-and-golden jersey before joining the action.</p>",
244,120,2023.0,1359476,PBKS v KKR,PBKS,KKR,PBKS,1,1,2,2,"Yadav to Prabhsimran Singh, 2 runs",False,False,False,1161024,Prabhsimran Singh,2.0,2.0,376116.0,Umesh Yadav,0.2,0.0,2.0,0.0,28235.0,Shikhar Dhawan,0.0,0.0,,,,,,,,,,,,,False,"<B>streaky runs</b> as this short-ish slower ball on off surprises the batter. Tries to tap it square but the ball takes a bottom edge and goes to Gurbaz awkwardly on the bounce. Misfield, slip gives it a chase",,
245,130,2023.0,1359476,PBKS v KKR,PBKS,KKR,PBKS,1,1,3,0,"Yadav to Prabhsimran Singh, no run",False,False,False,1161024,Prabhsimran Singh,2.0,3.0,376116.0,Umesh Yadav,0.3,0.0,2.0,0.0,28235.0,Shikhar Dhawan,0.0,0.0,,,,,,,,,,,,,False,that's more firm. Sweet sound off the bat. Good length ball outside off and guided after riding the bounce. To point,,
246,140,2023.0,1359476,PBKS v KKR,PBKS,KKR,PBKS,1,1,4,6,"Yadav to Prabhsimran Singh, SIX",True,False,False,1161024,Prabhsimran Singh,8.0,4.0,376116.0,Umesh Yadav,0.4,0.0,8.0,0.0,28235.0,Shikhar Dhawan,0.0,0.0,,,,,,,,,,,,,False,<B>#HereWeGo</b> from Prabhsimran. Umesh errs by bowling full on his toes and the batter smartly whips it off his pads and gets a six beyond deep backward square leg. The crowd's delighted!,,
247,150,2023.0,1359476,PBKS v KKR,PBKS,KKR,PBKS,1,1,5,0,"Yadav to Prabhsimran Singh, no run",False,False,False,1161024,Prabhsimran Singh,8.0,5.0,376116.0,Umesh Yadav,0.5,0.0,8.0,0.0,28235.0,Shikhar Dhawan,0.0,0.0,,,,,,,,,,,,,False,"good length ball, fourth-stump line and Singh doesn't have the room to get on top of this kind of delivery. Pushed towards cover point off the back foot",,"<p>CHANDAN: ""Why does Punjab not have an extra batter as they are batting first?"" -- They might get one in, once a top-order batter is out. Maybe Prabhsimran goes out for a Taide or a Bhatia. Or Rishi Dhawan for an all-round option.</p>"
248,160,2023.0,1359476,PBKS v KKR,PBKS,KKR,PBKS,1,1,6,1,"Yadav to Prabhsimran Singh, 1 run",False,False,False,1161024,Prabhsimran Singh,9.0,6.0,376116.0,Umesh Yadav,1.0,0.0,9.0,0.0,28235.0,Shikhar Dhawan,0.0,0.0,,,,,,,,,,,,,False,"<B>almost played on!</b> Prabhsimran would've had his heart in his mouth there. Tried to drive at a ball without any movement of the feet, away from his body. Inside edge took it past leg stump to short fine",,
249,11010,2023.0,1359476,PBKS v KKR,PBKS,KKR,PBKS,1,2,1,4,"Southee to Prabhsimran Singh, FOUR",True,False,False,1161024,Prabhsimran Singh,13.0,7.0,232364.0,Tim Southee,0.1,0.0,4.0,0.0,28235.0,Shikhar Dhawan,0.0,0.0,376116.0,Umesh Yadav,1.0,0.0,9.0,0.0,,,,,,,False,"full ball around middle and leg. He's searching for the swing but this slides into leg instead. Singh flicks it well, flicks it fine, and beats Umesh at deep fine leg!",,
250,11020,2023.0,1359476,PBKS v KKR,PBKS,KKR,PBKS,1,2,2,4,"Southee to Prabhsimran Singh, FOUR",True,False,False,1161024,Prabhsimran Singh,17.0,8.0,232364.0,Tim Southee,0.2,0.0,8.0,0.0,28235.0,Shikhar Dhawan,0.0,0.0,376116.0,Umesh Yadav,1.0,0.0,9.0,0.0,,,,,,,False,"<B>dancing shoes on!</b> Good length ball outside off but Singh wants to give Southee a charge. Gets forward, then offers a flat-batted thwack, and gets it past mid off this time!",,
